,superpower
329,you can break into a car or house without triggering the alarm * only if someone is inside
330,"when you dab, all good music shuts off in a 5 mile radius"
331,your breath can faint anyone if you breathe on them while thinking of toothpaste
332,you can project your voice 2 cm to your left
333,you can flex someone else’s muscles
334,you can talk to a frog. his name is gary
335,you can throw sticks of butter scarily accurately to your target
336,you can teleport one atom at a time
337,you clap your hands and you can turn bratwurst within 8 feet of you into concrete
338,inanimate objects sigh when you use them
339,you can teleport trough unlocked doors
340,you can turn invisible if no one is looking at you
341,"you can do up to triple digit multiplication in your head with ease only while pressing your index fingers against your temples, contorting your face, and grunting loudly"
342,you are completely invisible while wearing tap shoes
